{
  "contract": "f21d0974c7ec159cd0c0cee472a0eecdccef2a2cd26776a795e5ae5ef96cc71a",
  "created_at": "2026-09-14T12:15:50+00:00",
  "criteria": [
    "Les parcours Express, Feature et Produit relient les documents de cadrage au cycle de développement et à la préparation de PR",
    "Les documents versionnés, leurs entrées et leurs revues empêchent l’exécution avec un cadrage manquant ou périmé",
    "Les procédures sont utilisables par commandes ou skills dans plusieurs outils avec un contexte ciblé",
    "Les coûts du cadrage et du développement sont imputables par étape sans double compter les coûts communs",
    "Les refus, la compatibilité et un parcours complet sont testés et documentés dans le README et la notice"
  ],
  "evidence": "E-7543b32c1a5f",
  "fingerprint": "6e90521f7d1efd8c97a31397c3e3c778aab2564d5581cda26a85a2fbb36c795b",
  "id": "V-198983b8ab32",
  "reviewer": "method-review",
  "summary": "Verdict réel du sous-agent indépendant /root/method_review. Les cinq critères sont satisfaits : parcours complets, fraîcheur/entrées/revues, portabilité/contexte, coûts par étape, documentation et scénarios de refus. Deux défauts initiaux corrigés et réexaminés : états revue/shipping et contrôle du cadrage pendant orchestration. Preuve E-7543b32c1a5f courante (89 tests, 94 adaptateurs). Suggestion non bloquante : centraliser davantage les consignes communes des procédures. Découverte interactive dans chaque IDE non vérifiée.",
  "task": "T-6281659aad20",
  "verdict": "approve"
}
