{
  "contract": "de2eb4bbdef074c8d637551ebd6ae0732b08f1c38b80d7269153e8e80ee94019",
  "created_at": "2026-09-14T12:31:57+00:00",
  "criteria": [
    "Le catalogue ne propose que des bases publiques libres avec provenance et limites explicites",
    "La commande et le skill architecture respectent le choix entre boilerplate publique, architecture sur mesure et projet existant",
    "Le choix de base, sa révision et ses contraintes sont transmis aux agents et une modification invalide le cadrage concerné",
    "Les commandes, la notice et les scénarios de refus sont documentés et testés sans installer de SaaS ni appeler un fournisseur"
  ],
  "evidence": "E-9f6a10b6eb2c",
  "fingerprint": "4436056071fd8952a4a23a76c8e27ccbeb5089fe740f6fbda450502c6af71176",
  "id": "V-8162c5bf93c1",
  "reviewer": "architecture-review",
  "summary": "Verdict réel du sous-agent indépendant /root/method_review : quatre critères satisfaits. Profils MIT vérifiés sur les sources officielles, choix explicites transmis et liés au cadrage, compatibilité conservée, documentation et six nouveaux scénarios de refus validés. Preuve E-9f6a10b6eb2c courante : 95 tests et 94 adaptateurs. Aucun défaut restant identifié. Audit des codes des boilerplates hors périmètre ; aucune installation de SaaS.",
  "task": "T-6b0a3a1d068b",
  "verdict": "approve"
}
